{
  "$schema" : "creatorflow.manifest/v0.1",
  "project" : {
    "name" : "CreatorFlow-Real-Asset-Pack",
    "release" : "0.1.0"
  },
  "generatedAt" : "2026-07-13T01:53:43.857436Z",
  "summary" : {
    "total" : 32,
    "clear" : 31,
    "similar" : 1,
    "duplicate" : 0,
    "unresolvedSources" : 32,
    "pendingDecisions" : 32
  },
  "assets" : [ {
    "path" : "avocado-project-derivative.glb",
    "fileName" : "avocado-project-derivative.glb",
    "fileType" : "glb",
    "sizeBytes" : 8110208,
    "sha256" : "5d36edd89e44331da003f181b6fb3a2a98303922600e3093b213e78913415af7",
    "width" : 0,
    "height" : 0,
    "fingerprints" : {
      "dHash" : null,
      "pHash" : null,
      "audio" : null
    },
    "verification" : "CLEAR",
    "source" : {
      "source" : null,
      "license" : null,
      "evidenceUrl" : null
    },
    "decision" : "PENDING",
    "matches" : [ ],
    "findings" : [ "No readable embedded metadata for this file type." ]
  }, {
    "path" : "avocado-source.glb",
    "fileName" : "avocado-source.glb",
    "fileType" : "glb",
    "sizeBytes" : 8110040,
    "sha256" : "ccc9c3ce56423720b09399c2351537207cd5a65f859f9e6e2f30922762f3abd4",
    "width" : 0,
    "height" : 0,
    "fingerprints" : {
      "dHash" : null,
      "pHash" : null,
      "audio" : null
    },
    "verification" : "CLEAR",
    "source" : {
      "source" : null,
      "license" : null,
      "evidenceUrl" : null
    },
    "decision" : "PENDING",
    "matches" : [ ],
    "findings" : [ "No readable embedded metadata for this file type." ]
  }, {
    "path" : "avocado-source.jpg",
    "fileName" : "avocado-source.jpg",
    "fileType" : "jpg",
    "sizeBytes" : 3414,
    "sha256" : "e054be44df4b4f6ff99cf3467d78951b32557e6b6816a2a28af422db1abd98b4",
    "width" : 130,
    "height" : 130,
    "fingerprints" : {
      "dHash" : "2410642c4a2a1000",
      "pHash" : "e58c9633b3cc3332",
      "audio" : null
    },
    "verification" : "CLEAR",
    "source" : {
      "source" : null,
      "license" : null,
      "evidenceUrl" : null
    },
    "decision" : "PENDING",
    "matches" : [ ],
    "findings" : [ "No embedded authorship metadata. Common for exported game assets, but provenance cannot be confirmed from the file alone." ]
  }, {
    "path" : "barramundi-project-derivative.glb",
    "fileName" : "barramundi-project-derivative.glb",
    "fileType" : "glb",
    "sizeBytes" : 12488340,
    "sha256" : "1a4f497e657dcc33fc55c02fcbd7b5d610ab72b8f8b7ae8764ef69d9e20ed477",
    "width" : 0,
    "height" : 0,
    "fingerprints" : {
      "dHash" : null,
      "pHash" : null,
      "audio" : null
    },
    "verification" : "CLEAR",
    "source" : {
      "source" : null,
      "license" : null,
      "evidenceUrl" : null
    },
    "decision" : "PENDING",
    "matches" : [ ],
    "findings" : [ "No readable embedded metadata for this file type." ]
  }, {
    "path" : "barramundi-source.glb",
    "fileName" : "barramundi-source.glb",
    "fileType" : "glb",
    "sizeBytes" : 12488144,
    "sha256" : "ecc3bafb6b00f2c8b810863c388e3768a7b7ea0d0335e8cb8c574c266e571f4a",
    "width" : 0,
    "height" : 0,
    "fingerprints" : {
      "dHash" : null,
      "pHash" : null,
      "audio" : null
    },
    "verification" : "CLEAR",
    "source" : {
      "source" : null,
      "license" : null,
      "evidenceUrl" : null
    },
    "decision" : "PENDING",
    "matches" : [ ],
    "findings" : [ "No readable embedded metadata for this file type." ]
  }, {
    "path" : "barramundi-source.jpg",
    "fileName" : "barramundi-source.jpg",
    "fileType" : "jpg",
    "sizeBytes" : 2138,
    "sha256" : "34a9f786a7c9a32c629762b9241dd061f1833ccb7ecaa50b3193cf7ac0769933",
    "width" : 130,
    "height" : 130,
    "fingerprints" : {
      "dHash" : "00000a0244100000",
      "pHash" : "e5cf9a30674d3886",
      "audio" : null
    },
    "verification" : "CLEAR",
    "source" : {
      "source" : null,
      "license" : null,
      "evidenceUrl" : null
    },
    "decision" : "PENDING",
    "matches" : [ ],
    "findings" : [ "No embedded authorship metadata. Common for exported game assets, but provenance cannot be confirmed from the file alone." ]
  }, {
    "path" : "beautiful-game-ktx2-draco.glb",
    "fileName" : "beautiful-game-ktx2-draco.glb",
    "fileType" : "glb",
    "sizeBytes" : 12105252,
    "sha256" : "d950162d41e0064be9dfac0c09d80c7a23719a37af37f08cd79385b8af0af0c1",
    "width" : 0,
    "height" : 0,
    "fingerprints" : {
      "dHash" : null,
      "pHash" : null,
      "audio" : null
    },
    "verification" : "CLEAR",
    "source" : {
      "source" : null,
      "license" : null,
      "evidenceUrl" : null
    },
    "decision" : "PENDING",
    "matches" : [ ],
    "findings" : [ "No readable embedded metadata for this file type." ]
  }, {
    "path" : "beautiful-game.glb",
    "fileName" : "beautiful-game.glb",
    "fileType" : "glb",
    "sizeBytes" : 42977928,
    "sha256" : "bd7133b4b322aae97c589b8839dae8155ad2546acb35ae32a127e722a959d007",
    "width" : 0,
    "height" : 0,
    "fingerprints" : {
      "dHash" : null,
      "pHash" : null,
      "audio" : null
    },
    "verification" : "CLEAR",
    "source" : {
      "source" : null,
      "license" : null,
      "evidenceUrl" : null
    },
    "decision" : "PENDING",
    "matches" : [ ],
    "findings" : [ "No readable embedded metadata for this file type." ]
  }, {
    "path" : "beautiful-game.jpg",
    "fileName" : "beautiful-game.jpg",
    "fileType" : "jpg",
    "sizeBytes" : 419052,
    "sha256" : "d6cff003082c186639ac21df34ea12b402a1a906cf8059384a867b0166031237",
    "width" : 2425,
    "height" : 880,
    "fingerprints" : {
      "dHash" : "f0f25291c1d273f5",
      "pHash" : "c8a195d217663ead",
      "audio" : null
    },
    "verification" : "CLEAR",
    "source" : {
      "source" : null,
      "license" : null,
      "evidenceUrl" : null
    },
    "decision" : "PENDING",
    "matches" : [ ],
    "findings" : [ "No embedded authorship metadata. Common for exported game assets, but provenance cannot be confirmed from the file alone." ]
  }, {
    "path" : "boombox-project-derivative.glb",
    "fileName" : "boombox-project-derivative.glb",
    "fileType" : "glb",
    "sizeBytes" : 10614356,
    "sha256" : "1aa49e3fe779e292d39bcc0a71b0d297a098ccfbba5094fb46a162e59ce4f9a4",
    "width" : 0,
    "height" : 0,
    "fingerprints" : {
      "dHash" : null,
      "pHash" : null,
      "audio" : null
    },
    "verification" : "CLEAR",
    "source" : {
      "source" : null,
      "license" : null,
      "evidenceUrl" : null
    },
    "decision" : "PENDING",
    "matches" : [ ],
    "findings" : [ "No readable embedded metadata for this file type." ]
  }, {
    "path" : "boombox-source.glb",
    "fileName" : "boombox-source.glb",
    "fileType" : "glb",
    "sizeBytes" : 10614184,
    "sha256" : "f8b918445ebdd006768232205a62f5182d2208ca57f84c6ccc084943c0bc8f15",
    "width" : 0,
    "height" : 0,
    "fingerprints" : {
      "dHash" : null,
      "pHash" : null,
      "audio" : null
    },
    "verification" : "CLEAR",
    "source" : {
      "source" : null,
      "license" : null,
      "evidenceUrl" : null
    },
    "decision" : "PENDING",
    "matches" : [ ],
    "findings" : [ "No readable embedded metadata for this file type." ]
  }, {
    "path" : "boombox-source.jpg",
    "fileName" : "boombox-source.jpg",
    "fileType" : "jpg",
    "sizeBytes" : 326958,
    "sha256" : "604216e2a950fb2b4b34dcc012892bc42cc26684d27d3cf9b95d244e6d2b4c23",
    "width" : 1000,
    "height" : 924,
    "fingerprints" : {
      "dHash" : "002a97619b69150c",
      "pHash" : "ffc1e52790dac260",
      "audio" : null
    },
    "verification" : "CLEAR",
    "source" : {
      "source" : null,
      "license" : null,
      "evidenceUrl" : null
    },
    "decision" : "PENDING",
    "matches" : [ ],
    "findings" : [ "Software: Greenshot" ]
  }, {
    "path" : "corset.glb",
    "fileName" : "corset.glb",
    "fileType" : "glb",
    "sizeBytes" : 13491364,
    "sha256" : "9582c0dc0dee813be77f60e6ddf7213987c7e11497bf3cc66fd7b18957ae0d26",
    "width" : 0,
    "height" : 0,
    "fingerprints" : {
      "dHash" : null,
      "pHash" : null,
      "audio" : null
    },
    "verification" : "CLEAR",
    "source" : {
      "source" : null,
      "license" : null,
      "evidenceUrl" : null
    },
    "decision" : "PENDING",
    "matches" : [ ],
    "findings" : [ "No readable embedded metadata for this file type." ]
  }, {
    "path" : "corset.jpg",
    "fileName" : "corset.jpg",
    "fileType" : "jpg",
    "sizeBytes" : 3150,
    "sha256" : "93bd99c4eb74fe9b45a0026a0b95bdff683b130511abce4ec3fd7fb4eb163876",
    "width" : 130,
    "height" : 130,
    "fingerprints" : {
      "dHash" : "082a0c0c0c0e1628",
      "pHash" : "e69ecd63b3613448",
      "audio" : null
    },
    "verification" : "CLEAR",
    "source" : {
      "source" : null,
      "license" : null,
      "evidenceUrl" : null
    },
    "decision" : "PENDING",
    "matches" : [ ],
    "findings" : [ "No embedded authorship metadata. Common for exported game assets, but provenance cannot be confirmed from the file alone." ]
  }, {
    "path" : "dutch-ship-large-01.glb",
    "fileName" : "dutch-ship-large-01.glb",
    "fileType" : "glb",
    "sizeBytes" : 107145484,
    "sha256" : "968d8713cceebd13c8f36231f1368b11050537a8c2889e9c652ce2c275f08bf2",
    "width" : 0,
    "height" : 0,
    "fingerprints" : {
      "dHash" : null,
      "pHash" : null,
      "audio" : null
    },
    "verification" : "CLEAR",
    "source" : {
      "source" : null,
      "license" : null,
      "evidenceUrl" : null
    },
    "decision" : "PENDING",
    "matches" : [ ],
    "findings" : [ "No readable embedded metadata for this file type." ]
  }, {
    "path" : "dutch-ship-large-01.png",
    "fileName" : "dutch-ship-large-01.png",
    "fileType" : "png",
    "sizeBytes" : 438390,